{
  "schema_version": "argus.review_spec.v1alpha1",
  "request_id": "review-request-diff-001",
  "idempotency_key": "local-diff-001",
  "tenant_id": "tenant-local",
  "workspace_id": "workspace-argus",
  "repository": {
    "provider": "local",
    "repository_id": "argus"
  },
  "target": {
    "mode": "diff",
    "diff": {
      "base_revision": "1111111111111111111111111111111111111111",
      "head_revision": "2222222222222222222222222222222222222222",
      "patch": {
        "uri": "artifact://argus/patches/diff-001",
        "sha256": "aaaaaaaaaaaaaaaaaaaaaaaaaaaaaaaaaaaaaaaaaaaaaaaaaaaaaaaaaaaaaaaa",
        "size_bytes": 128
      }
    }
  },
  "config_bundle_ref": {
    "id": "config-default",
    "revision": "1",
    "sha256": "bbbbbbbbbbbbbbbbbbbbbbbbbbbbbbbbbbbbbbbbbbbbbbbbbbbbbbbbbbbbbbbb"
  },
  "workflow_ref": {
    "id": "workflow-default",
    "revision": "1",
    "sha256": "cccccccccccccccccccccccccccccccccccccccccccccccccccccccccccccccc"
  },
  "requested_outputs": [
    "findings",
    "report",
    "trace"
  ],
  "remote_writes": "deny"
}
